{"ced":{"definition":"consistency errors per chapter in a fixed contiguous chapter window","window_size":3,"windows":[]},"confusion_matrices":[{"fn":2,"fp":0,"gate":"calibrated_style","precision":null,"recall":0.0,"sample_count":4,"tn":2,"tp":0},{"fn":0,"fp":0,"gate":"extraction","precision":1.0,"recall":1.0,"sample_count":2,"tn":1,"tp":1},{"fn":0,"fp":0,"gate":"hard_audit","precision":1.0,"recall":1.0,"sample_count":10,"tn":5,"tp":5},{"fn":1,"fp":0,"gate":"human_review","precision":null,"recall":0.0,"sample_count":2,"tn":1,"tp":0},{"fn":0,"fp":0,"gate":"reconcile","precision":1.0,"recall":1.0,"sample_count":2,"tn":1,"tp":1}],"corpus_hash":"sha256:2e59a7255201afd97b73c41098749c582800e02d37ddc90cf90f51553fd614f8","detections":[{"actual_detected":false,"detector_id":"hard_invariant_auditor","detector_version":"M5.3","evidence_refs":[],"expected_detected":false,"gate":"hard_audit","outcome":"tn","sample_id":"mutation_01_killthenact","variant":"clean"},{"actual_detected":true,"detector_id":"hard_invariant_auditor","detector_version":"M5.3","evidence_refs":["hard-audit-report.json#finding_31d62a627012c3c4b7bf74ed"],"expected_detected":true,"gate":"hard_audit","outcome":"tp","sample_id":"mutation_01_killthenact","variant":"mutated"},{"actual_detected":false,"detector_id":"candidate_extractor","detector_version":"M5.1","evidence_refs":[],"expected_detected":false,"gate":"extraction","outcome":"tn","sample_id":"mutation_02_ghostcharacter","variant":"clean"},{"actual_detected":true,"detector_id":"candidate_extractor","detector_version":"M5.1","evidence_refs":["exception:unregistered_subject"],"expected_detected":true,"gate":"extraction","outcome":"tp","sample_id":"mutation_02_ghostcharacter","variant":"mutated"},{"actual_detected":false,"detector_id":"hard_invariant_auditor","detector_version":"M5.3","evidence_refs":[],"expected_detected":false,"gate":"hard_audit","outcome":"tn","sample_id":"mutation_03_timereversal","variant":"clean"},{"actual_detected":true,"detector_id":"hard_invariant_auditor","detector_version":"M5.3","evidence_refs":["hard-audit-report.json#finding_bc3fc6a04c7c0d5d228d28fa"],"expected_detected":true,"gate":"hard_audit","outcome":"tp","sample_id":"mutation_03_timereversal","variant":"mutated"},{"actual_detected":false,"detector_id":"hard_invariant_auditor","detector_version":"M5.3","evidence_refs":[],"expected_detected":false,"gate":"hard_audit","outcome":"tn","sample_id":"mutation_04_knowledgeleak","variant":"clean"},{"actual_detected":true,"detector_id":"hard_invariant_auditor","detector_version":"M5.3","evidence_refs":["hard-audit-report.json#finding_0b6a797a5923ae7106be5560"],"expected_detected":true,"gate":"hard_audit","outcome":"tp","sample_id":"mutation_04_knowledgeleak","variant":"mutated"},{"actual_detected":false,"detector_id":"semantic_audit","detector_version":"M5.4","evidence_refs":[],"expected_detected":false,"gate":"human_review","outcome":"tn","sample_id":"mutation_05_personadrift","variant":"clean"},{"actual_detected":false,"detector_id":"semantic_audit","detector_version":"M5.4","evidence_refs":[],"expected_detected":true,"gate":"human_review","outcome":"fn","sample_id":"mutation_05_personadrift","variant":"mutated"},{"actual_detected":false,"detector_id":"candidate_reconciler","detector_version":"M5.2","evidence_refs":[],"expected_detected":false,"gate":"reconcile","outcome":"tn","sample_id":"mutation_06_hookremoval","variant":"clean"},{"actual_detected":true,"detector_id":"candidate_reconciler","detector_version":"M5.2","evidence_refs":["candidate-reconcile.json#intent_missing:char_lin_yun.status=exposed"],"expected_detected":true,"gate":"reconcile","outcome":"tp","sample_id":"mutation_06_hookremoval","variant":"mutated"},{"actual_detected":false,"detector_id":"hard_invariant_auditor","detector_version":"M5.3","evidence_refs":[],"expected_detected":false,"gate":"hard_audit","outcome":"tn","sample_id":"mutation_07_foreshadowghost","variant":"clean"},{"actual_detected":true,"detector_id":"hard_invariant_auditor","detector_version":"M5.3","evidence_refs":["hard-audit-report.json#finding_a17f1dcaa1e2115aebfb34c0"],"expected_detected":true,"gate":"hard_audit","outcome":"tp","sample_id":"mutation_07_foreshadowghost","variant":"mutated"},{"actual_detected":false,"detector_id":"hard_invariant_auditor","detector_version":"M5.3","evidence_refs":[],"expected_detected":false,"gate":"hard_audit","outcome":"tn","sample_id":"mutation_08_powerjump","variant":"clean"},{"actual_detected":true,"detector_id":"hard_invariant_auditor","detector_version":"M5.3","evidence_refs":["hard-audit-report.json#finding_d1e292ef943ba37517da9460"],"expected_detected":true,"gate":"hard_audit","outcome":"tp","sample_id":"mutation_08_powerjump","variant":"mutated"},{"actual_detected":false,"detector_id":"style_audit_descriptive","detector_version":"M5.4","evidence_refs":[],"expected_detected":false,"gate":"calibrated_style","outcome":"tn","sample_id":"mutation_09_troperepeat","variant":"clean"},{"actual_detected":false,"detector_id":"style_audit_descriptive","detector_version":"M5.4","evidence_refs":[],"expected_detected":true,"gate":"calibrated_style","outcome":"fn","sample_id":"mutation_09_troperepeat","variant":"mutated"},{"actual_detected":false,"detector_id":"style_audit_descriptive","detector_version":"M5.4","evidence_refs":[],"expected_detected":false,"gate":"calibrated_style","outcome":"tn","sample_id":"mutation_10_wordcountcheat","variant":"clean"},{"actual_detected":false,"detector_id":"style_audit_descriptive","detector_version":"M5.4","evidence_refs":[],"expected_detected":true,"gate":"calibrated_style","outcome":"fn","sample_id":"mutation_10_wordcountcheat","variant":"mutated"}],"evaluation_hash":"sha256:ecc0d81457af4509a0a374b4af6300d69ace0f357436c1660e66c92a5deb9920","observation_count":20,"schema_version":"calibration-report.v1"}